{
  "$schema": "http://json-schema.org/draft-07/schema#",
  "title": "Proposal Template",
  "description": "Schema for engage-exocortex exploration proposal document template",
  "type": "object",
  "required": ["description", "filePattern", "sections"],
  "additionalProperties": false,
  "properties": {
    "$schema": { "type": "string" },
    "description": { "type": "string" },
    "filePattern": { "type": "string" },
    "auditSiblingPattern": { "type": "string", "description": "File pattern for the sibling audit JSON that carries raw subagent envelopes and full scoring matrix." },
    "sizeTarget": { "type": "string", "description": "Human-readable size target for the main proposal (e.g., '< 8KB for typical runs')." },
    "sections": {
      "type": "array",
      "items": {
        "type": "object",
        "required": ["id", "heading"],
        "properties": {
          "id": { "type": "string" },
          "heading": { "type": "string" },
          "content": { "type": "string" },
          "optional": { "type": "boolean" },
          "condition": { "type": "string" },
          "renderWhen": { "type": "string", "description": "Conditional render expression (e.g., 'fabricationRisk === true'). When present, the section is rendered only when the expression is satisfied at proposal-write time." },
          "repeating": { "type": "boolean" },
          "fields": {
            "type": "array",
            "items": {
              "type": "object",
              "required": ["key", "label"],
              "properties": {
                "key": { "type": "string" },
                "label": { "type": "string" },
                "value": { "type": "string" },
                "format": { "type": "string" },
                "default": { "type": ["string", "boolean", "number", "null"] },
                "optional": { "type": "boolean" },
                "description": { "type": "string" }
              },
              "additionalProperties": false
            }
          },
          "subsections": {
            "type": "array",
            "items": {
              "type": "object",
              "required": ["heading", "content"],
              "properties": {
                "heading": { "type": "string" },
                "content": { "type": "string" }
              },
              "additionalProperties": false
            }
          }
        },
        "additionalProperties": false
      }
    }
  }
}
