{
  "$schema": "proposal-template-schema.json",
  "description": "Document structure template for engage-prism analysis proposal generation (Step 5). Slim by design — decision-focused; raw subagent envelopes live in the sibling PRISM-{question-slug}.audit.json file. Target: main proposal < 8KB for typical runs.",
  "filePattern": "Proposal/PRISM-{question-slug}.md",
  "auditSiblingPattern": "Proposal/PRISM-{question-slug}.audit.json",
  "sizeTarget": "Main proposal < 8KB for typical runs. Keep decision-focused; offload raw structured data to the audit JSON sibling file.",
  "sections": [
    {
      "id": "metadata",
      "heading": "# Parallel Analysis: {questionTitle}",
      "fields": [
        { "key": "date", "label": "Date", "format": "YYYY-MM-DD" },
        { "key": "skill", "label": "Skill", "value": "engage-prism" },
        { "key": "pathsExplored", "label": "Paths Explored", "format": "integer" },
        { "key": "webResearchPerformed", "label": "Web Research Performed", "format": "boolean" },
        { "key": "convergent", "label": "Convergent", "format": "boolean — see disagreement-audit phase" },
        { "key": "bearPathTriggered", "label": "Bear Path Triggered", "format": "boolean — see Step 2 red-team heuristic" },
        { "key": "auditSibling", "label": "Audit File", "format": "path to PRISM-{slug}.audit.json" }
      ]
    },
    {
      "id": "question",
      "heading": "## Question",
      "content": "{originalUserQuery}"
    },
    {
      "id": "research-plan",
      "heading": "## Research Plan",
      "content": "Entity anchors, source classes, recency window, authority preferences, and fetch budget from Step 0. If webResearchPerformed=false, this section includes the degradation reason and the implication for the recommendation."
    },
    {
      "id": "signal-analysis",
      "heading": "## Signal Analysis",
      "content": "One-line footnote only: name the matched signals or 'adaptive mode (no signal match)' or 'default routing — primary agent named paths directly'. Full signal-matching detail (weights, per-paradigm scores, rejected angles) lives in the sibling PRISM-{question-slug}.audit.json under signalAnalysis[]. Do not repeat the signal table inline — the main proposal is decision-focused."
    },
    {
      "id": "path",
      "heading": "## Path {N}: {pathName}",
      "repeating": true,
      "subsections": [
        {
          "heading": "### Brief",
          "content": "One-sentence angle summary plus the path's declared primarySourceClass. Full brief (researchPlan, exclusions, constraints) lives in the audit JSON sibling file under paths[N].brief."
        },
        {
          "heading": "### Report",
          "content": "Narrative summary only (3–6 sentences): core claim, strongest citation (title + one-line excerpt), notable gaps. Full structured report — citations[], webResearch, attemptedCalls[], evidenceBase, analysis steps, recommendation — lives in the audit JSON sibling file under paths[N].report. Never paste raw JSON inline."
        }
      ]
    },
    {
      "id": "synthesis",
      "heading": "## Synthesis",
      "subsections": [
        {
          "heading": "### Disagreement Audit",
          "content": "Convergent flag (true|false) and named disagreement points when convergent=false. On convergent=true, include the consensus-or-groupthink caveat. See disagreement-audit phase in synthesis-config.json."
        },
        {
          "heading": "### Bear Path Outcome",
          "content": "When bearPathTriggered=true, state whether the bear survived validation and the one-line counter-case summary. When bearPathTriggered=false, omit this subsection."
        },
        {
          "heading": "### Scoring Summary",
          "content": "One-line-per-path winner + disqualification notes only. Full scoring matrix (per-dimension scores) lives in the audit JSON sibling under synthesis.scoringMatrix."
        },
        {
          "heading": "### Hybridization",
          "content": "Named hybrid (if any) with specific integration point. Skip if no hybrid."
        }
      ]
    },
    {
      "id": "recommendation",
      "heading": "## Recommendation",
      "content": "Final recommendation with rationale that references specific citations. Must explicitly surface convergent flag, bear-path outcome, and any degraded path."
    },
    {
      "id": "what-would-change-this",
      "heading": "## What Would Change This Answer",
      "content": "2-3 specific observations — new evidence, updated input, or counterfactual — that would flip the recommendation."
    },
    {
      "id": "audit-pointer",
      "heading": "## Audit",
      "content": "Raw subagent envelopes, full citation lists, per-dimension scoring matrix, attemptedCalls[] records, and signal-matching tables are written alongside this proposal to PRISM-{question-slug}.audit.json. The audit file is machine-readable JSON conforming to the report-schema.json shape for each path plus a synthesis block. Keep the main proposal decision-focused; consult the audit JSON for verification."
    }
  ]
}
